Feature,Description,Technology,Priority,Implementation Status
Zero Knowledge Proof Generation,Generate ZK proofs for private certificate verification,Solidity Smart Contract,High,✓ Ready
Certificate Upload & Storage,Upload certificates with metadata extraction to blockchain,Flask API + Hardhat,High,✓ Ready
Blockchain Verification,Ethereum blockchain for immutable certificate storage,Ganache + Solidity,High,✓ Ready
Smart Contract Deployment,Automatic contract deployment with Hardhat,Hardhat + Web3.js,High,✓ Ready
Python Blockchain Handler,Easy-to-use Python interface for blockchain operations,web3.py,High,✓ Ready
REST API Endpoints,8 comprehensive API endpoints for frontend integration,Flask + Python,High,✓ Ready
Certificate Verification Methods,Verify by ID / Hash / File Upload,Smart Contract + API,High,✓ Ready
File Hash Generation,SHA-256 hash generation for certificate files,Python + Hashlib,High,✓ Ready
Frontend Integration,Web3 integration with HTML frontend,JavaScript + Fetch API,High,✓ Ready
Admin Dashboard,System status and certificate management interface,HTML + CSS + JavaScript,Medium,✓ Ready
Real-time Status Display,Live blockchain connection status display,JavaScript,Medium,✓ Ready
Certificate List Management,Display all certificates from blockchain,Smart Contract View,Medium,✓ Ready
Multi-verification Methods,Verify by ID/Hash/File with instant feedback,API Endpoints,Medium,✓ Ready
Drag & Drop Upload,Intuitive file upload with drag & drop,HTML5 + JavaScript,Medium,✓ Ready
Responsive Design,Mobile-first responsive design,CSS Grid/Flexbox,Medium,✓ Ready
Transaction Tracking,Track all transactions on blockchain,Ganache Explorer,Medium,✓ Ready
Error Handling,Comprehensive error messages and validation,Flask Error Handlers,High,✓ Ready
Security Features,CORS enabled/Input validation/File restrictions,Flask-CORS + Validation,High,✓ Ready
Local Development Setup,Complete setup guide with Ganache + Hardhat,Docker/Scripts,Medium,✓ Ready
API Documentation,Complete API endpoint documentation,Flask + Python Docs,Medium,✓ Ready
Configuration Files,Hardhat config + Python requirements + NPM packages,Configuration,High,✓ Ready
Database-less Architecture,All data on blockchain - no database needed,Solidity + Smart Contract,High,✓ Ready
Deployment Scripts,Automated deployment with testing,Node.js Scripts,High,✓ Ready
Immutable Records,Permanent certificate records on blockchain,Ethereum Blockchain,High,✓ Ready
Quick Start Guide,Complete 15-minute setup guide,Markdown Docs,High,✓ Ready